Company;Established;Number of Employees;Locations;Company Type;Description;Male ratio;age variance
TechNova Solutions;2010;500;"San Francisco, CA; New York, NY; Austin, TX; London, UK; Berlin, Germany; Tokyo, Japan; Sydney, Australia; Toronto, Canada";Technology Consultancy;TechNova Solutions, founded in 2010, is a premier technology consultancy firm dedicated to driving digital transformation and enhancing IT strategies for businesses worldwide. With a robust team of 500 professionals, TechNova operates from eight strategic locations, including its headquarters in San Francisco and major offices across North America, Europe, Asia, and Australia. The company specializes in implementing cutting-edge solutions in cloud computing, cybersecurity, and data analytics, partnering with clients to optimize enterprise resource planning (ERP) systems and develop bespoke software applications tailored to specific business needs. TechNova is renowned for its collaborative approach, ensuring that each project not only meets but exceeds client expectations, thereby fostering sustainable growth and operational efficiency.;55% male;"18-25: 15%; 26-35: 45%; 36-45: 30%; 46-60: 9%; 60+: 1%"
InnovateX Systems;2015;300;"Seattle, WA; Denver, CO; Chicago, IL; Amsterdam, Netherlands; Singapore";Product Provider;InnovateX Systems, established in 2015, is a dynamic product provider specializing in innovative software solutions for the healthcare and finance sectors. Employing 300 dedicated professionals, InnovateX operates from five key locations, including its main hub in Seattle and offices strategically positioned in Denver, Chicago, Amsterdam, and Singapore. The company is best known for its flagship products, such as a comprehensive electronic health records (EHR) system and a robust financial analytics platform. InnovateX emphasizes user-centric design and seamless integration, ensuring that their products adapt to the evolving needs of clients. Through continuous research and development, InnovateX Systems maintains its competitive edge, delivering solutions that enhance operational efficiency, compliance, and data-driven decision-making for businesses globally.;60% male;"18-25: 18%; 26-35: 50%; 36-45: 25%; 46-60: 6%; 60+: 1%"
QuantumLeap Technologies;2008;750;"Boston, MA; San Diego, CA; Miami, FL; London, UK; Paris, France; Munich, Germany; Tokyo, Japan; Shanghai, China; Bangalore, India; Sydney, Australia; São Paulo, Brazil; Johannesburg, South Africa";Research and Development (R&D) Firm;QuantumLeap Technologies, founded in 2008, stands at the forefront of artificial intelligence (AI) and machine learning (ML) advancements as a leading R&D firm. With a robust workforce of 750 scientists and engineers, QuantumLeap operates from 12 global hubs, including major centers in Boston, London, Tokyo, and Bangalore. The company engages in pioneering projects such as autonomous systems, natural language processing, and predictive analytics, collaborating with universities, government agencies, and private enterprises to push the boundaries of AI capabilities. QuantumLeap’s innovative solutions aim to revolutionize industries by enhancing decision-making processes, automating complex tasks, and providing intelligent insights. Their commitment to cutting-edge research and development ensures that QuantumLeap Technologies remains a pivotal player in shaping the future of AI and its applications across various sectors.;58% male;"18-25: 12%; 26-35: 50%; 36-45: 28%; 46-60: 9%; 60+: 1%"
ApexWave Labs;2012;450;"Austin, TX; Denver, CO; Toronto, Canada; Berlin, Germany; Bangalore, India; Sydney, Australia";Software Development Studio;ApexWave Labs, established in 2012, is a cutting-edge software development studio renowned for creating mobile and web applications tailored to the entertainment and education industries. With a talented team of 450 developers and designers, ApexWave operates from six international locations, including its headquarters in Austin and offices in Denver, Toronto, Berlin, Bangalore, and Sydney. The studio's portfolio boasts award-winning mobile games, interactive learning platforms, and immersive virtual reality (VR) experiences. ApexWave Labs employs an agile development methodology, enabling rapid prototyping and iterative enhancements that ensure high-quality, user-friendly applications. By leveraging the latest technologies and creative design principles, ApexWave delivers engaging and innovative solutions that captivate audiences and enhance educational outcomes, solidifying its reputation as a leader in software development.;52% male;"18-25: 20%; 26-35: 40%; 36-45: 25%; 46-60: 13%; 60+: 2%"
CyberEdge Dynamics;2016;250;"New York, NY; Washington, D.C.; London, UK; Singapore";Cybersecurity Solutions Provider;Founded in 2016, CyberEdge Dynamics is a leading cybersecurity solutions provider committed to protecting businesses from evolving digital threats. Employing 250 cybersecurity experts, CyberEdge operates from four major locations, including its headquarters in New York and offices in Washington, D.C., London, and Singapore. The company offers a comprehensive suite of services, including threat intelligence, incident response, vulnerability assessments, and managed security services. CyberEdge’s state-of-the-art Security Operations Centers (SOCs) provide real-time monitoring and risk mitigation, ensuring the protection of sensitive data and IT infrastructures. By staying ahead of emerging threats through continuous research and the adoption of advanced security technologies, CyberEdge Dynamics delivers robust and reliable cybersecurity defenses, making it a trusted partner for organizations seeking to safeguard their digital assets.;65% male;"18-25: 17%; 26-35: 48%; 36-45: 25%; 46-60: 8%; 60+: 2%"
NeuraTech Innovations;2014;600;"Chicago, IL; Boston, MA; Los Angeles, CA; Toronto, Canada; Tokyo, Japan; Berlin, Germany; Sydney, Australia";Biotechnology and AI Integration;NeuraTech Innovations, founded in 2014, is a pioneering company at the intersection of biotechnology and artificial intelligence, dedicated to developing advanced healthcare solutions. With a dedicated team of 600 professionals, including biotechnologists, data scientists, and AI specialists, NeuraTech operates from seven global offices in Chicago, Boston, Los Angeles, Toronto, Tokyo, Berlin, and Sydney. The company focuses on projects related to personalized medicine, bioinformatics, and neural network-based diagnostic tools. By collaborating with hospitals, research institutions, and pharmaceutical companies, NeuraTech Innovations leverages big data and machine learning to unlock new insights in genomics and disease prediction. Their innovative approach aims to enhance patient care, streamline medical research, and advance the capabilities of healthcare technologies, positioning NeuraTech as a leader in the biotech-AI convergence space.;57% male;"18-25: 14%; 26-35: 42%; 36-45: 30%; 46-60: 13%; 60+: 1%"
FusionSphere Networks;2009;800;"San Francisco, CA; New York, NY; London, UK; Frankfurt, Germany; Singapore; Tokyo, Japan; Sydney, Australia; Dubai, UAE; Toronto, Canada; São Paulo, Brazil";Cloud Computing and Networking;FusionSphere Networks, established in 2009, is a global leader in cloud computing and networking solutions, providing scalable and secure infrastructure services to businesses of all sizes. With a workforce of 800 experts, FusionSphere operates from ten strategic locations worldwide, including its headquarters in San Francisco and offices in New York, London, Frankfurt, Singapore, Tokyo, Sydney, Dubai, Toronto, and São Paulo. The company offers a wide range of services, including cloud storage, virtual networking, data center management, and cybersecurity integration. FusionSphere Networks is renowned for its robust and reliable cloud platforms that support high-availability applications and large-scale data processing. Their innovative projects involve developing hybrid cloud environments, optimizing network performance with AI-driven analytics, and ensuring compliance with international data protection regulations. FusionSphere's commitment to excellence and customer-centric approach makes them a preferred partner for organizations seeking comprehensive cloud and networking solutions.;63% male;"18-25: 16%; 26-35: 50%; 36-45: 25%; 46-60: 8%; 60+: 1%"
StellarSoft Inc.;2011;350;"Miami, FL; Los Angeles, CA; London, UK; Bangalore, India; Berlin, Germany";Enterprise Software Solutions;StellarSoft Inc., founded in 2011, specializes in developing enterprise software solutions that streamline business operations and enhance productivity. With a dedicated team of 350 employees, StellarSoft operates from five key locations, including its headquarters in Miami and offices in Los Angeles, London, Bangalore, and Berlin. The company offers a comprehensive suite of products, including customer relationship management (CRM) systems, enterprise resource planning (ERP) software, and workforce management tools. StellarSoft Inc. focuses on customizing software to meet the unique needs of clients across various industries such as finance, healthcare, and retail. By leveraging the latest technologies like artificial intelligence and machine learning, StellarSoft delivers intelligent and adaptive software solutions that drive business efficiency and foster digital transformation. Their emphasis on user-friendly interfaces and seamless integration ensures that businesses can effectively manage their resources and achieve sustainable growth.;54% male;"18-25: 19%; 26-35: 47%; 36-45: 26%; 46-60: 7%; 60+: 1%"
PixelPulse Studios;2013;400;"Austin, TX; Los Angeles, CA; New York, NY; Toronto, Canada; London, UK; Tokyo, Japan";Game Development and Interactive Media;PixelPulse Studios, established in 2013, is a renowned game development and interactive media company dedicated to creating immersive and engaging experiences for gamers worldwide. With a talented team of 400 creative professionals, PixelPulse operates from six vibrant locations, including its headquarters in Austin and offices in Los Angeles, New York, Toronto, London, and Tokyo. The studio's portfolio includes critically acclaimed video games, virtual reality (VR) experiences, and augmented reality (AR) applications. PixelPulse Studios is known for its innovative approach to game design, incorporating cutting-edge graphics, compelling storytelling, and intuitive gameplay mechanics. Their projects range from action-packed adventures and strategic simulations to educational games that make learning fun. By fostering a collaborative and creative work environment, PixelPulse ensures that their games resonate with diverse audiences and set new standards in the gaming industry.;50% male;"18-25: 17%; 26-35: 45%; 36-45: 28%; 46-60: 9%; 60+: 1%"
HyperDrive Software;2007;1000;"Seattle, WA; San Francisco, CA; New York, NY; London, UK; Berlin, Germany; Paris, France; Tokyo, Japan; Shanghai, China; Bangalore, India; Sydney, Australia; Toronto, Canada; Amsterdam, Netherlands; Dubai, UAE; São Paulo, Brazil; Johannesburg, South Africa";Full-Stack Software Development and IT Services;HyperDrive Software, founded in 2007, is a global powerhouse in full-stack software development and IT services, delivering comprehensive solutions to enterprises across various industries. With a substantial workforce of 1,000 employees, HyperDrive operates from fifteen international locations, including its headquarters in Seattle and offices in San Francisco, New York, London, Berlin, Paris, Tokyo, Shanghai, Bangalore, Sydney, Toronto, Amsterdam, Dubai, São Paulo, and Johannesburg. The company offers a wide array of services, including custom software development, mobile application creation, cloud integration, and IT consulting. HyperDrive Software undertakes diverse projects, from developing scalable e-commerce platforms and robust cybersecurity systems to creating innovative mobile apps and enterprise-grade software solutions. Their team of experts leverages the latest technologies, such as blockchain, artificial intelligence, and the Internet of Things (IoT), to build solutions that drive business efficiency and foster digital transformation. HyperDrive's commitment to quality, innovation, and customer satisfaction has established them as a trusted partner for organizations seeking reliable and cutting-edge IT services.;62% male;"18-25: 15%; 26-35: 48%; 36-45: 27%; 46-60: 9%; 60+: 1%"
